{
  "$schema": "https://json-schema.org/draft/2020-12/schema",
  "$id": "rusty.quest.native_app_build.v1",
  "title": "Rusty Quest native app build spec",
  "type": "object",
  "additionalProperties": false,
  "required": [
    "schema",
    "app_id",
    "owner_repo",
    "package_policy",
    "package_name",
    "requested_features",
    "denied_features",
    "payloads",
    "permission_allowlist",
    "declared_manifest",
    "expected_render_mode",
    "settings_assertions",
    "expected_markers",
    "validation_tier"
  ],
  "properties": {
    "schema": {
      "const": "rusty.quest.native_app_build.v1"
    },
    "app_id": {
      "type": "string",
      "pattern": "^[a-z0-9_]+(\\.[a-z0-9_]+)*$"
    },
    "owner_repo": {
      "type": "string",
      "minLength": 1
    },
    "package_policy": {
      "type": "string",
      "enum": [
        "native-renderer-dev-package",
        "app-specific-package"
      ]
    },
    "package_name": {
      "type": "string",
      "minLength": 1
    },
    "requested_features": {
      "type": "array",
      "items": {
        "type": "string"
      },
      "uniqueItems": true
    },
    "denied_features": {
      "type": "array",
      "items": {
        "type": "string"
      },
      "uniqueItems": true
    },
    "payloads": {
      "type": "array",
      "items": {
        "type": "object"
      }
    },
    "private_asset_provider_request": {
      "type": "object",
      "additionalProperties": false,
      "required": [
        "schema",
        "provider_id",
        "provider_manifest_sha256",
        "inventory_sha256",
        "asset_count"
      ],
      "properties": {
        "schema": {
          "const": "rusty.quest.native_app_private_asset_provider_request.v1"
        },
        "provider_id": {
          "type": "string",
          "pattern": "^[a-z0-9]+(?:[._-][a-z0-9]+)*$"
        },
        "provider_manifest_sha256": {
          "type": "string",
          "minLength": 64,
          "maxLength": 64,
          "pattern": "^[0-9a-f]{64}$"
        },
        "inventory_sha256": {
          "type": "string",
          "minLength": 64,
          "maxLength": 64,
          "pattern": "^[0-9a-f]{64}$"
        },
        "asset_count": {
          "type": "integer",
          "minimum": 1,
          "maximum": 32
        }
      }
    },
    "permission_allowlist": {
      "type": "array",
      "items": {
        "type": "string"
      },
      "uniqueItems": true
    },
    "declared_manifest": {
      "type": "object",
      "additionalProperties": false,
      "required": [
        "permissions",
        "uses_features",
        "activities",
        "services"
      ],
      "properties": {
        "permissions": {
          "type": "array",
          "items": {
            "type": "string"
          },
          "uniqueItems": true
        },
        "uses_features": {
          "type": "array",
          "items": {
            "type": "string"
          },
          "uniqueItems": true
        },
        "activities": {
          "type": "array",
          "items": {
            "type": "string"
          },
          "uniqueItems": true
        },
        "services": {
          "type": "array",
          "items": {
            "type": "string"
          },
          "uniqueItems": true
        }
      }
    },
    "expected_render_mode": {
      "type": "string",
      "minLength": 1
    },
    "runtime_profile": {
      "type": "object",
      "additionalProperties": false,
      "required": [
        "set"
      ],
      "properties": {
        "set": {
          "type": "object",
          "additionalProperties": {
            "type": "string"
          }
        }
      }
    },
    "settings_assertions": {
      "type": "object",
      "additionalProperties": false,
      "required": [
        "required_values",
        "required_disabled_modules",
        "required_modules",
        "forbidden_modules"
      ],
      "properties": {
        "required_values": {
          "type": "object",
          "additionalProperties": {
            "type": "string"
          }
        },
        "required_disabled_modules": {
          "type": "array",
          "items": {
            "type": "string",
            "minLength": 1
          },
          "uniqueItems": true
        },
        "required_modules": {
          "type": "array",
          "items": {
            "type": "string",
            "minLength": 1
          },
          "uniqueItems": true
        },
        "forbidden_modules": {
          "type": "array",
          "items": {
            "type": "string",
            "minLength": 1
          },
          "uniqueItems": true
        }
      }
    },
    "expected_markers": {
      "type": "object",
      "additionalProperties": false,
      "required": [
        "required",
        "forbidden"
      ],
      "properties": {
        "required": {
          "type": "array",
          "items": {
            "type": "string"
          },
          "uniqueItems": true
        },
        "forbidden": {
          "type": "array",
          "items": {
            "type": "string"
          },
          "uniqueItems": true
        }
      }
    },
    "validation_tier": {
      "type": "string",
      "enum": [
        "quick",
        "standard",
        "device"
      ]
    }
  }
}
